{
  "schema": 3,
  "id": 12,
  "job": "api-review",
  "source": "spawn",
  "placement": {
    "terminal": "kitty",
    "socket": "unix:/tmp/kitty-{kitty.pid}-4099",
    "window_id": 7,
    "tab_title": "api review",
    "user_vars": {
      "project": "api"
    }
  },
  "extra": {
    "ticket": "auth-3",
    "ratio": 1.10,
    "tags": [
      "a",
      "b"
    ]
  },
  "template": "review"
}
